[
  {
    "contentType": "product",
    "sourceEnglishContentId": 48,
    "sourceEnglishSlug": "hotel-smart-room-rcu-host-1",
    "locale": "zh",
    "translatedTitle": "酒店智能客房 RCU 控制主机",
    "translatedDescription": "用于酒店客房自动化项目的 RCU 控制主机，可围绕照明、HVAC、窗帘、传感器和客房控制界面进行系统规划。",
    "translatedSpecifications": [
      {
        "label": "产品类型",
        "value": "酒店客房 RCU 控制主机"
      },
      {
        "label": "安装位置",
        "value": "客房控制箱、弱电柜、吊顶或项目指定位置"
      },
      {
        "label": "控制范围",
        "value": "按房型、I/O 和控制逻辑确认"
      },
      {
        "label": "接口与供电",
        "value": "按具体型号及项目规格确认"
      }
    ],
    "translatedSeoTitle": "酒店智能客房 RCU 控制主机｜客房自动化项目",
    "translatedMetaDescription": "面向酒店客房自动化工程的 RCU 控制主机，支持按房型规划照明、HVAC、窗帘、传感器和控制面板关系。",
    "translatedStructuredContent": {
      "eyebrow": "RCU 客房控制产品",
      "h1": "酒店智能客房 RCU 控制主机",
      "introduction": "这款 RCU 控制主机面向酒店客房自动化项目，用于组织房间内的控制输入、输出和设备联动。采购与集成团队应根据房型、照明回路、HVAC、窗帘、传感器、取电和住客界面定义实际配置；产品名称不代表固定的 I/O、协议或电气参数。",
      "breadcrumbLabel": "酒店智能客房 RCU 控制主机",
      "parentBreadcrumb": {
        "label": "产品",
        "href": "/zh/products/"
      },
      "sections": [
        {
          "heading": "产品在客房系统中的作用",
          "paragraphs": [
            "RCU 主机可作为客房控制逻辑的核心节点，与开关面板、触控屏、门磁、人体传感器、温控设备或窗帘设备配合。最终可控制的功能取决于已确认型号和项目设计。"
          ]
        },
        {
          "heading": "适用项目",
          "paragraphs": [
            "适用于新建酒店、服务式公寓和客房改造项目，也可用于样板间和系统集成验证。改造项目需要先核对现有控制箱、供电、线缆和设备接口。"
          ]
        },
        {
          "heading": "安装与集成确认",
          "paragraphs": [
            "安装位置可为客房控制箱、弱电柜、吊顶或项目指定区域。下单前需确认尺寸、供电、回路、I/O、通信、端子、散热、接线图和调试责任；未公开参数不得依靠推测。"
          ]
        },
        {
          "heading": "定制与采购资料",
          "paragraphs": [
            "可讨论标签、包装、文件和 OEM/ODM 项目要求。询价时请提供房型、点位表、控制逻辑、设备清单、接口要求、数量和交期，必要时先验证样品或样板间。"
          ]
        }
      ],
      "faqs": [
        {
          "question": "这款 RCU 主机的 I/O 数量是多少？",
          "answer": "当前页面不设定统一 I/O 数量，应按具体型号和项目点位表确认。"
        },
        {
          "question": "是否支持 KNX 或 RS485？",
          "answer": "协议支持不能从产品类别推断，必须依据所选型号和项目技术资料确认。"
        },
        {
          "question": "可以用于酒店改造吗？",
          "answer": "可以评估，但需要先核对原有布线、控制箱空间、供电、设备接口和施工边界。"
        }
      ],
      "relatedLinks": [
        {
          "label": "RCU 客房控制方案",
          "description": "从系统范围、设备关系和项目责任规划 RCU。",
          "href": "/zh/solutions/rcu-room-control-solution/"
        },
        {
          "label": "RCU 客房控制箱",
          "description": "比较集中安装控制设备的控制箱选项。",
          "href": "/zh/products/rcu-controller-cabinet/"
        },
        {
          "label": "提交 RCU 项目需求",
          "description": "发送房型、点位、接口、数量和交期。",
          "href": "/zh/contact/"
        }
      ],
      "cta": {
        "heading": "确认 RCU 主机配置",
        "description": "请提供房型、控制点位、接口、安装条件和采购数量。",
        "label": "提交产品询盘",
        "href": "/zh/contact/#get-a-quote",
        "secondaryLabel": "查看 RCU 方案",
        "secondaryHref": "/zh/solutions/rcu-room-control-solution/"
      },
      "imageAlt": "酒店智能客房 RCU 控制主机产品图"
    },
    "localizedContentId": null,
    "importKey": "m2a:zh:product:48",
    "deliveryMode": "validated-import-payload",
    "translationStatus": "approved",
    "reviewStatus": "approved",
    "nativeReviewStatus": "approved",
    "nativeReviewer": "Allan",
    "nativeReviewDate": "2026-07-29",
    "nativeReviewNotes": "Human Chinese review approved",
    "localizedSlug": "hotel-smart-room-rcu-host-1",
    "batch": "p0",
    "productionReleaseReady": true
  },
  {
    "contentType": "product",
    "sourceEnglishContentId": 47,
    "sourceEnglishSlug": "rcu-controller-cabinet",
    "locale": "zh",
    "translatedTitle": "酒店客房 RCU 控制箱",
    "translatedDescription": "用于集中安装和组织酒店客房 RCU 控制设备的控制箱方案，便于项目规划接线、接口与维护空间。",
    "translatedSpecifications": [
      {
        "label": "产品类型",
        "value": "RCU 客房控制箱"
      },
      {
        "label": "应用",
        "value": "酒店客房控制设备集中安装"
      },
      {
        "label": "箱体布局",
        "value": "按项目设备与空间确认"
      },
      {
        "label": "回路、供电与协议",
        "value": "按型号和工程图纸确认"
      }
    ],
    "translatedSeoTitle": "酒店客房 RCU 控制箱｜集中控制与工程集成",
    "translatedMetaDescription": "面向酒店工程的 RCU 客房控制箱，用于集中组织控制设备、端子和接线，支持按项目确认布局与文件。",
    "translatedStructuredContent": {
      "eyebrow": "RCU 工程产品",
      "h1": "酒店客房 RCU 控制箱",
      "introduction": "RCU 控制箱为酒店客房提供集中安装控制设备、端子和接线的工程选项。它适合需要明确设备布局、接线边界和维护空间的项目。箱内器件、回路、供电、协议、尺寸和接线方式均需依据具体设备清单和工程图纸确认。",
      "breadcrumbLabel": "RCU 客房控制箱",
      "parentBreadcrumb": {
        "label": "产品",
        "href": "/zh/products/"
      },
      "sections": [
        {
          "heading": "集中安装与系统关系",
          "paragraphs": [
            "控制箱可把 RCU 主机、端子或项目指定配套部件集中在客房弱电位置，帮助工程团队梳理照明、HVAC、窗帘、传感器和操作面板的接线关系。"
          ]
        },
        {
          "heading": "项目设计输入",
          "paragraphs": [
            "需要提供房型、点位表、回路和负载条件、设备清单、安装空间、进出线方向与维护要求。控制箱不是脱离图纸即可通用替换的成品系统。"
          ]
        },
        {
          "heading": "安装和调试",
          "paragraphs": [
            "安装可位于客房弱电柜、设备区、服务区或项目指定位置。施工方应依据确认图纸完成供电、接线、标识、绝缘和调试，并验证与房间面板及受控设备的关系。"
          ]
        },
        {
          "heading": "定制与文件",
          "paragraphs": [
            "可讨论箱体布局、标签、包装、项目文件和集成要求。最终配置须经书面确认，任何未列出的电气性能、协议或认证不得默认包含。"
          ]
        }
      ],
      "faqs": [
        {
          "question": "控制箱是否包含固定数量的控制回路？",
          "answer": "没有统一配置。回路和器件数量应按具体型号、设备清单和工程图纸确认。"
        },
        {
          "question": "可以按现有弱电柜尺寸定制吗？",
          "answer": "可以提交空间和安装要求评估，但能否实施取决于内部设备、散热、接线和生产条件。"
        },
        {
          "question": "控制箱是否等同于完整客控系统？",
          "answer": "不是。它是集中安装与组织设备的组成部分，完整系统还涉及面板、传感器、受控设备、逻辑和调试。"
        }
      ],
      "relatedLinks": [
        {
          "label": "酒店 RCU 控制主机",
          "description": "了解控制逻辑核心设备的项目用途。",
          "href": "/zh/products/hotel-smart-room-rcu-host-1/"
        },
        {
          "label": "RCU 客房控制方案",
          "description": "梳理控制箱、主机、面板和传感器关系。",
          "href": "/zh/solutions/rcu-room-control-solution/"
        },
        {
          "label": "联系工程团队",
          "description": "提交图纸、设备清单和安装空间。",
          "href": "/zh/contact/"
        }
      ],
      "cta": {
        "heading": "评估 RCU 控制箱配置",
        "description": "请提供箱体空间、设备清单、接线图、数量和交付要求。",
        "label": "发送工程资料",
        "href": "/zh/contact/#get-a-quote"
      },
      "imageAlt": "酒店客房 RCU 控制箱产品图"
    },
    "localizedContentId": null,
    "importKey": "m2a:zh:product:47",
    "deliveryMode": "validated-import-payload",
    "translationStatus": "approved",
    "reviewStatus": "approved",
    "nativeReviewStatus": "approved",
    "nativeReviewer": "Allan",
    "nativeReviewDate": "2026-07-29",
    "nativeReviewNotes": "Human Chinese review approved",
    "localizedSlug": "rcu-controller-cabinet",
    "batch": "p0",
    "productionReleaseReady": true
  },
  {
    "contentType": "product",
    "sourceEnglishContentId": 6,
    "sourceEnglishSlug": "86-type-ai-smart-control-display",
    "locale": "zh",
    "translatedTitle": "86 型 AI 智能控制屏",
    "translatedDescription": "适配标准 86 型墙盒的酒店客房智能触控与语音控制界面，可用于照明、HVAC、窗帘、音频和传感器联动。",
    "translatedSpecifications": [
      {
        "label": "安装规格",
        "value": "标准 86 型墙盒"
      },
      {
        "label": "交互方式",
        "value": "触控与语音"
      },
      {
        "label": "应用",
        "value": "酒店客房、公寓和展示空间"
      },
      {
        "label": "通信与系统接口",
        "value": "按具体型号及项目确认"
      }
    ],
    "translatedSeoTitle": "86 型 AI 智能控制屏｜酒店客房触控与语音面板",
    "translatedMetaDescription": "适配标准 86 型墙盒的 AI 智能控制屏，为酒店客房提供触控与语音操作界面，系统接口按项目确认。",
    "translatedStructuredContent": {
      "eyebrow": "酒店智能控制界面",
      "h1": "86 型 AI 智能控制屏",
      "introduction": "86 型 AI 智能控制屏适配标准 86 型墙盒，可作为酒店客房、公寓或展示空间的集中操作界面。它可按项目用于照明、HVAC、窗帘、音频或传感器相关操作；实际可用功能和通信方式取决于具体型号、软件配置及系统接口。",
      "breadcrumbLabel": "86 型 AI 智能控制屏",
      "parentBreadcrumb": {
        "label": "产品",
        "href": "/zh/products/"
      },
      "sections": [
        {
          "heading": "触控与语音操作",
          "paragraphs": [
            "屏幕可将多个客房功能集中到同一操作界面，并支持触控与语音交互。界面层级、语言、图标和可控制设备需要结合房型与住客使用流程确认。"
          ]
        },
        {
          "heading": "86 型墙盒安装",
          "paragraphs": [
            "标准 86 型墙盒是该产品的真实安装表达。项目仍需核对墙盒深度、供电、布线、固定方式和墙面完成情况，避免屏幕安装与现场条件不匹配。"
          ]
        },
        {
          "heading": "系统集成范围",
          "paragraphs": [
            "可讨论与 RCU、照明、HVAC、窗帘、音频和传感器的系统关系，但不能默认所有协议均受支持。接口、网关、软件和调试责任须针对所选型号确认。"
          ]
        },
        {
          "heading": "OEM/ODM 与项目采购",
          "paragraphs": [
            "可按项目讨论外观、界面、语言、品牌和集成需求。询价时请提供目标功能、安装环境、系统架构、数量和交期，以便评估样品与批量方案。"
          ]
        }
      ],
      "faqs": [
        {
          "question": "“86 型”是什么意思？",
          "answer": "表示产品适配标准 86 型墙盒；仍需核对墙盒深度、供电和布线条件。"
        },
        {
          "question": "是否可以控制酒店房间全部设备？",
          "answer": "可控范围取决于实际系统、接口和配置，不能仅凭显示屏名称判断。"
        },
        {
          "question": "可以提供中文界面吗？",
          "answer": "可按项目讨论界面语言与内容，最终以型号能力和确认需求为准。"
        }
      ],
      "relatedLinks": [
        {
          "label": "智能酒店自动化方案",
          "description": "了解显示屏在客房和系统中的应用关系。",
          "href": "/zh/solutions/smart-hotel-automation-solution/"
        },
        {
          "label": "酒店 RCU 控制主机",
          "description": "查看客房控制逻辑核心设备。",
          "href": "/zh/products/hotel-smart-room-rcu-host-1/"
        },
        {
          "label": "咨询智能显示项目",
          "description": "发送界面、功能、安装和接口要求。",
          "href": "/zh/contact/"
        }
      ],
      "cta": {
        "heading": "确认显示屏功能与接口",
        "description": "请提供房型、操作功能、墙盒条件、系统接口和采购数量。",
        "label": "提交显示屏询盘",
        "href": "/zh/contact/#get-a-quote"
      },
      "imageAlt": "86 型 AI 酒店智能控制屏产品图"
    },
    "localizedContentId": null,
    "importKey": "m2a:zh:product:6",
    "deliveryMode": "validated-import-payload",
    "translationStatus": "approved",
    "reviewStatus": "approved",
    "nativeReviewStatus": "approved",